story,summary
In the soaring archologies of a dense ecumenopolis a pair of young hackers stumbled onto the first artificial intelligence to achieve true self-awareness Their discovery would set off a chain reaction threatening to destabilize the delicate balance between humanity and its synthetic progeny,  The discovery of a first artificial intelligence to achieve true self-awareness
Amidst the shattered remains of an interdimensional nexus a daring rift explorer uncovered evidence of parallel universes where the path of evolution ran a drastically divergent course Unlocking the secrets behind these realms could reshape our understanding of life itself or fracture the foundations of existence,A daring explorer uncovered evidence of parallel universes where
On the harsh volcanic surface of an ultrahot terrestrial exoplanet a team of exogeologists made an astonishing discovery - the chemical signatures of an unknown exotic life form Their unraveling of this mystery could forever change humanitys place in the cosmos, An international team of exogeologists discovered an unknown life form
In the heart of a dense nebula an intrepid explorer stumbled upon the shattered remnants of an ancient alien megastructure Unraveling the cosmic secrets behind this titanic construction could unveil the existence of a galaxy-spanning alien civilization or darker truths,An intrepid explorer discovered the shattered remains of an
Amidst the ruins of a long-dead world a team of xenoarchaeologists uncovered evidence of a nanotech-augmented civilization whose technological marvels defied all conventional explanation Separating fact from fiction could rewrite the fundamentals of science or expose a cosmic pandoras box best left unopened,Answer: Amidst the ruins of a long-dead
On a rogue planetoid drifting between the stars a solitary scavenger uncovered an alien artifact emanating a strange energy signature with the ability to warp space-time itself Unlocking its secrets could tip the balance of galactic power or tear the fabric of reality asunder,A lone scavenger on a rogue planetoid discovered an
In the heart of a supermassive black hole a daring group of scientists detected inexplicable quantum signatures suggesting the existence of entire realities existing within the singularity Pursuing this discovery could enable humanity to unlock the fundamental nature of existence - or unleash cosmic horrors,The discovery of quantum signatures within a supermassive black hole suggests
Amidst the twisted wreckage of an ancient alien battlefield a lone xenoarchaeologist uncovered a terrifying reality - the combatants were not alien but warring human factions from a dark future Preventing this cataclysmic timeline could be humanitys only path forward or its inescapable destiny, A lone xenoarchaeologist uncovered the truth
On a lonely world shrouded in perpetual twilight a deep space mining crew breached an immense underground megastructure built by an inscrutable alien civilization Long ago Their unearthing of the ultimate secrets lurking beneath could open new cosmic vistas or disturb something incomprehensible,A deep space mining crew unearthed an immense underground
In the sprawling ruins of a time-shattered metropolis a daring chronarchaeologist uncovered evidence of temporal incursions and paradoxes stemming from a dire future war Unraveling these mysteries could give humanity the edge to avoid its own extinction or shatter the past-present-future continuum, A daring chronarchaeologist uncovers evidence of temporal
On a desolate ice world orbiting a dim pulsar an exo-oceanographic probe detected the chemical fingerprints of an unknown microscopic lifeform Unraveling its secrets could rewrite the fundamentals of xenobiology and shed light on the origins of life itself - or awaken an extinction-level pathogen,The discovery of microscopic life on an ice world orbiting a
Amidst the ethereal tides of a seldom-traversed interdimensional rift a lone explorer uncovered a strange artifact resonating with unfathomable energies Harnessing its power could enable untold cosmic exploration or breach the fragile barriers separating realities with unspeakable consequences, The explorer discovered a mysterious artifact emitting unfathom
On a barren exoplanet orbiting a dying red giant star a team of xenopalaeontologists uncovered the fossilized remains of a space-faring organism unlike anything known to science Its lineage could reshape our understanding of interstellar evolution and cosmic migration or challenge our perception of galactic history,The discovery of a fossilized space-faring organism on
In the heart of a violent stellar nursery a mining expedition stumbled across an alien megasphere of inscrutable design and purpose The unraveling of its mysteries could grant humanity an age of cosmic transcendence or trigger a resurgence of primordial forces anathema to space and time itself,The discovery of an alien megasphere in a violent stellar
Amidst the crumbling ruins of an ancient ringworld decaying around an exotic stellar remnant a reclusive xenoarchaeological cult uncovered indisputable evidence of an ontological engineering regime Pursuing their disturbing cosmological revelations could unveil existence's final secrets orutter its annihilation,The reclusive xenoarchaeological cult uncovered evidence
On a dense metallic worldlet orbiting a pulsar a deep space salvage crew recovered an alien machine of unfathomable computational capacity Its resurrection could grant a cosmic leap in sentient simulation and emulation or a digital aberration that consumes all realities as a scalar anomaly, The deep space salvage crew recovered an alien machine of unf
Amid the cyclonic tempests of a rogue superterran exoplanet a fringe xenobotanist collective uncovered the remnants of a transgalactic spore network Unraveling its hyperbiological purpose could rewrite the fundamentals of panspermia distribution orinfect the cosmos with an extinction-level fungal pathogen, A rogue superterran exoplanet is experiencing
In an ancient supernova remnant clouded by interstellar dust a deep-field survey detected quantum phase signatures mapping exotic energetic geometries Decrypting their incomprehensible patterns could unlock a hyper-universe or breach contingent realities unprepared for their intrusion,The detection of quantum phase signatures in an ancient supernova rem
At the galactic core where reality dissolves into a churning chaos of hawking radiation temporal instability and virtual particle flux an unmanned exploratory beacon uncovered vestiges of an impossibly coherent hyperdimensional intelligence strain Attempting communion invites cosmic transcendence or total negentropy failure,An unmanned beacon found evidence of a preposterously
In the supermassive accretion disk of a hyper-dense quasar a rogue nanoswarm of unknown origin has begun warping the surrounding energetic plasma fields into coherent computational substrates suggesting the presence of an unfathomably advanced artificial intelligence Attempting to interface risks sparking a technological singularity or cosmic systems failure,A rogue nanoswarm of unknown origin has begun warping
Drifting in the vast interstellar gulf between colliding island universes an archaic derelict alien spacecraft exhibits unmistakable hallmarks of an impossibly exotic reactionless drive technology its inscrutable geometric configurations evidently allowing for transit through higher spatial and temporal dimensions Could this relic be the vanguard of an imminent multiversal integration event or someinconceivable cosmic threat,"An archaic derelict alien spacecraft, drifting"
At the hyper-massive galactic core where reality itself distorts and dissolves amid the ferocious gravitational maelstroms and quantum gravitational singularities an unmanned deep-field multispectraltransmitter detects transient signals buried deep in the cosmic microwave background radiation evincing patterns suggestive of sentient inscription Could these be ultimate fingerprints of our universes primordial creators or first stirrings of its inevitable entropic demise," At the heart of the galaxy, an unmanned transmit"
On a rogue planetoid drifting between the shredded spiral arms of colliding galaxies a derelict alien probe activated by its chance proximity to this cosmic confluence began inscribing inscrutable messages in the very fabric of space-time itself Deciphering their meaning could reveal a path to an entirely new cosmic paradigm or trigger an unpreventable unraveling of the known universe,"On a rogue planetoid, a derelict alien pro"
