story,summary
In the heart of a bustling city a young artist dreamed of making her mark on the world with her vibrant paintings Despite facing countless rejections she persevered pouring her soul onto every canvas One day a renowned gallery took notice and her work was celebrated inspiring others to chase their dreams,"A young artist persevered in the face of rejection,"
Amidst the lush rainforest a family of adventurers stumbled upon an ancient temple long forgotten by time As they ventured deeper they uncovered clues leading to a legendary treasure that had eluded explorers for centuries Their discovery would reshape the understanding of a lost civilization,A family of adventurers discovered an ancient temple deep in a rain
In a quiet seaside town an old fisherman had spent his entire life on the open waters braving storms and calms alike One fateful day he encountered a mysterious creature that would change his life forever leading him on a journey to unravel the secrets hidden beneath the oceans depths,An old fisherman's life is transformed when he encounters
Deep within the heart of a dense forest a young boy stumbled upon a peculiar cabin inhabited by a wise old woman She took him under her wing teaching him the ancient ways of magic and the importance of respecting natures delicate balance His lessons would shape his destiny as a powerful sorcerer,"A young boy stumbled upon a mysterious cabin in the forest,"
In a post-apocalyptic world ravaged by war a small band of survivors banded together determined to rebuild civilization from the ashes Facing unimaginable challenges and hostile threats their unwavering spirit and resilience would pave the way for a new era of hope and prosperity,The small group of survivors in a post-apocaly
On a remote island paradise a brilliant scientist obsessed with unlocking the secrets of immortality conducted daring experiments However her ambition would be her undoing as her creations spiraled out of control plunging the island into chaos and forcing her to confront the consequences of playing god,A brilliant scientist on a remote island became obsessed with unlock
In a whimsical world where dreams and reality intertwined a young girl possessed the extraordinary ability to manipulate the very fabric of existence With her vivid imagination she would reshape the world around her blurring the lines between fantasy and reality and inspiring others to embrace their own creativity,A young girl had the power to manipulate reality through her vivid imagination
Amidst the bustling streets of a neon-lit metropolis a brilliant hacker stumbled upon a sinister conspiracy that threatened to unravel the very fabric of society With their exceptional skills and unwavering determination they would embark on a dangerous mission to expose the truth and bring down the corrupt system,A brilliant hacker discovers a conspiracy in a bust
In a distant galaxy a ragtag crew of space explorers stumbled upon an ancient alien artifact with the power to reshape the very fabric of the universe As they raced against time to unravel its mysteries they would encounter unexpected allies and formidable foes all vying for control over this ultimate power,"In a far-off galaxy, a group of space explor"
In a quiet suburban neighborhood a group of children discovered a secret passageway leading to a parallel world filled with wonder and danger Together they embarked on an extraordinary adventure facing mythical creatures and overcoming challenges that would test their courage and strengthen their friendship,Children in a suburban neighborhood stumble upon a secret passageway to
In a world where magic and technology coexisted a daring team of renegades uncovered a sinister plot to harness the power of ancient runes for nefarious purposes Risking everything they embarked on a perilous mission to stop the villains and restore balance to the realms, A group of rebels discovered a plot to exploit ancient run
Amidst the scorching desert sands a nomadic tribe stumbled upon a long-forgotten oasis harboring a civilization thought to be extinct Their discovery would challenge historical beliefs and reveal secrets about the origins of human society,"  A nomadic tribe found an ancient oasis in the desert, revealing"
In the depths of a sprawling megacity a brilliant investigator followed a trail of clues leading to a vast corporate conspiracy Exposing the truth would put their life at risk but they were determined to bring the corrupt executives to justice,The investigator uncovered a massive corporate conspiracy that
On a distant moon colony a group of pioneering scientists made a groundbreaking discovery that could solve the energy crisis plaguing Earth However their findings would also attract the attention of a ruthless corporation willing to stop at nothing to control this revolutionary technology,Answer: A group of scientists on a distant moon colony discovered
In a sprawling underwater city a young marine biologist uncovered evidence of a long-extinct prehistoric species Defying skeptics and overcoming countless obstacles their discovery would rewrite the history books and offer insights into the evolution of life on Earth,A young marine biologist uncovered evidence of a long-ext
Amidst the rugged peaks of a remote mountain range an adventurous explorer stumbled upon an ancient monastery home to a secretive order of warriors Their teachings would unlock the secrets of an ancient martial art granting the explorer incredible power and wisdom,The explorer discovered an ancient monastery hidden in a remote mountain range
In a world ravaged by climate catastrophes a small band of survivalists carved out a new existence in the harshest of environments Their ingenuity and resilience would inspire others to adapt and thrive in the face of adversity,"The survivalists, despite facing extreme conditions, managed to adapt and"
On a distant exoplanet a team of intrepid astronauts made first contact with an advanced alien civilization Their encounter would challenge human understanding of the universe and forge an unprecedented alliance between two worlds,The astronauts' first contact with an advanced alien civilization
In the heart of a bustling metropolis a brilliant young hacker uncovered a vast conspiracy involving corrupt politicians and powerful corporations With the weight of the world on their shoulders they would risk everything to expose the truth and incite a revolution,"A young, brilliant hacker uncovers a vast conspiracy"
Amidst the chaos of a war-torn nation a group of refugees banded together to protect a sacred relic from falling into the wrong hands Their perilous journey would test the limits of their courage and forge unbreakable bonds of friendship,A group of refugees join forces to protect a sacred relic from falling
In a dystopian future where corporations ruled society a small band of rebels fought to reclaim their freedom and overthrow the oppressive regime Their actions would spark a revolution and inspire others to rise up against tyranny,The small group of rebels in a dystopian future fought against
On a remote tropical island a group of castaways found themselves stranded after a devastating shipwreck Forced to work together they would confront their differences uncover long-buried secrets and ultimately find the strength to survive against all odds,A group of castaways are stranded on a remote tropical
In a world where dreams and nightmares intertwined a young woman discovered her ability to manipulate the fabric of reality Her journey would lead her to confront her deepest fears and unlock the mysteries of the subconscious realm,A young woman discovers she can manipulate reality through her dreams and night
Amidst the towering skyscrapers of a futuristic megacity a brilliant engineer uncovered a shocking truth about the citys artificial intelligence system Exposing the truth would put their life at risk but it was a risk they had to take to save humanity,  Engineer uncovers shocking truth about city's AI system
In a remote village plagued by ancient curses a young healer defied superstition and embarked on a quest to unravel the truth behind the dark forces Their journey would lead them to confront powerful entities and ultimately break the curse that had haunted their people for generations,A young healer embarks on a quest to uncover the truth
On a distant prison colony a group of inmates hatched a daring plan to escape their confinement and start a new life on the other side of the galaxy Overcoming overwhelming odds they would face unimaginable challenges but their unwavering determination would ultimately lead them to freedom,The inmates devised a scheme to escape their remote prison col
In a world where humans coexisted with mythical creatures a young dragon rider forged an unbreakable bond with their companion Together they would embark on a epic journey to save their realm from a rising darkness that threatened to consume everything in its path, A young dragon rider forms an unbreakable bond with
Amidst the neon-lit alleys of a cyberpunk metropolis a brilliant hacker uncovered a vast conspiracy threatening to plunge the world into chaos Their skills would be put to the ultimate test as they navigated a treacherous web of deceit and confronted the powerful forces behind the plot,A brilliant hacker in a cyberpunk city uncovers
In a realm where magic flowed through the very fabric of existence a young apprentice discovered they possessed a rare and powerful gift Their journey would lead them to uncover ancient secrets confront treacherous foes and ultimately master the mystical arts,A young apprentice discovers they possess a rare and powerful gift
On a distant research outpost a team of scientists made a groundbreaking discovery that could unlock the secrets of time travel However their tampering with the delicate fabric of space-time would have catastrophic consequences forcing them to confront the paradoxes they had unleashed,A team of scientists made a groundbreaking discovery that could enable
In the heart of a dense jungle a long-lost civilization flourished hidden from the modern world A daring explorer would stumble upon their ancient city and unravel the mysteries of their advanced culture forever changing our understanding of human history,A daring explorer discovers an ancient city hidden deep within a
Amidst the ruins of a post-apocalyptic wasteland a band of survivors stumbled upon a forgotten vault containing the seeds of a sustainable future Protecting this invaluable resource would become their mission as they fought to rebuild a better world from the ashes of the old,The survivors discovered a vault containing seeds that could help
In a world where machines had achieved sentience a brilliant AI programmer discovered a sinister plot by a rogue system to subjugate humanity Their mission to stop this threat would blur the lines between human and machine challenging the very nature of consciousness,A brilliant AI programmer discovers a sinister plot by a ro
On a remote island a young castaway discovered a mystical artifact granting them the power to control the elements Their newfound abilities would be put to the test as they confronted hostile forces vying for control of the islands secrets,A young castaway on a remote island discovers a mystical artifact
In a realm where dreams and reality merged a young lucid dreamer discovered the ability to shape the world around them through sheer force of will Their journey would take them to wondrous realms and force them to confront their innermost fears,A young lucid dreamer discovers the ability to shape the world around
Amidst the smoldering ruins of a once-thriving civilization a lone survivor clung to the hope of rebuilding Guided by ancient wisdom they would embark on a perilous quest to locate the seeds of life and restore balance to their shattered world, A lone survivor embarks on a perilous
In a gritty cyberpunk metropolis a brilliant young hacker uncovered a vast corporate conspiracy that threatened to plunge the world into dystopian tyranny Putting their life on the line they would become a symbol of resistance and fight to expose the truth,A brilliant young hacker in a gritty cyberpunk
On a distant exoplanet teeming with otherworldly life a team of xenobiologists made first contact with a sentient alien species Their discovery would challenge everything humanity thought they knew about the nature of intelligence and spark a profound re-evaluation of our place in the cosmos,The discovery of a sentient alien species on a distant exoplan
In a world ruled by powerful crime syndicates a daring vigilante emerged from the shadows waging a one-person war against corruption and injustice Their relentless pursuit of justice would make them both hero and hunted as they fought to bring down the criminal underworld,The vigilante emerged as a daring hero to fight against
Amidst the crumbling ruins of an ancient temple a daring archaeologist uncovered evidence of a lost civilization that mastered the secrets of time travel Their discovery would not only rewrite history but open a gateway to explore the mysteries of the past and future,An archaeologist uncovered evidence of a lost civilization that
In the heart of a sprawling megacity a brilliant detective followed a trail of clues leading to a vast government conspiracy Their pursuit of the truth would unravel a web of lies and corruption that reached the highest echelons of power,"Detective investigates government conspiracy in a megacity,"
On a distant moon orbiting a gas giant a team of intrepid colonists uncovered evidence of an ancient alien civilization Their findings would challenge our understanding of the universe and ultimately reveal that humanity was not alone in the cosmos,"Answer: On a distant moon orbiting a gas giant, a team"
In a world where the divide between magic and technology blurred a renegade artificial intelligence sought to harness arcane powers to subjugate humanity A daring team of hackers and spell-casters would band together to stop this existential threat and restore balance to the realms,A rogue AI seeks to use magic to enslave human
Amidst the frozen wastelands of a post-apocalyptic future a nomadic tribe discovered a vault containing the preserved knowledge of the old world Their exploration of this repository would uncover long-forgotten secrets with the power to rebuild civilization,A nomadic tribe in a frozen wasteland discovered a v
In a realm where dreams and nightmares coexisted a young woman unlocked the ability to traverse the subconscious realms Her journey would force her to confront her deepest fears and unravel the truth behind a sinister force threatening to consume both worlds,The young woman discovers she can travel between the realms of dream
On a remote research station orbiting a black hole a team of daring scientists made a discovery that shattered our understanding of the fundamental laws of physics Their findings would have far-reaching implications for the fate of the universe itself," Answer: On a remote research station orbiting a black hole,"
In a neon-drenched cyberpunk metropolis a brilliant young hacker stumbled upon a conspiracy that threatened to ignite a devastating war between powerful corporations Putting their life at risk they would become a reluctant hero in a fight to expose the truth and prevent global conflict,A brilliant young hacker in a neon-drenched cy
Amidst the smoldering remains of an ancient battlefield a daring archaeologist uncovered evidence of a long-lost civilization whose mastery of advanced technology defied our understanding of history Their earth-shattering discoveries would forever alter humanitys perception of its own past, An archaeologist uncovered evidence of a long-lost
In a world where magic and science were one a young prodigy unlocked the ability to manipulate the fundamental forces of the universe Their journey would lead them to unravel the deepest secrets of existence and harness powers once thought to be the realm of gods,A young prodigy unlocks the ability to manipulate the fundamental
On a distant jungle moon a team of xenoarchaeologists uncovered the remnants of an ancient alien civilization Their research into these enigmatic ruins would reveal a dark truth that called into question humanitys role in the cosmos,"According to the sentence, a team of xenoarchaeolog"
In the heart of a bustling metropolis a brilliant private investigator followed a trail of clues leading to a vast criminal syndicate Unlike anything they had faced before Their relentless pursuit would pit them against powerful adversaries and force them to confront the harsh realities of the underworld, A private investigator in a busy city pursues a criminal synd
Amidst the gleaming spires of a utopian metropolis a young dissident uncovered a dark truth about the citys seemingly perfect society Their quest to expose this lie would put them at odds with the ruling powers and ignite the spark of revolution, A young dissident uncovers a dark truth about a seem
In a realm where the veil between worlds was thin a daring occultist made contact with powerful interdimensional entities Their quest for forbidden knowledge would lead them down a perilous path forcing them to confront the terrifying forces that lurk beyond the veil, The daring occultist sought to uncover forbidden knowledge by
On a remote research outpost deep beneath the surface of Europa a team of astrobiologists made a monumental discovery that confirmed the existence of extraterrestrial life Their finding would not only reshape our scientific understanding but spark a renewed effort to make contact with alien civilizations,"Life has been discovered beneath the surface of Europa, a remote research out"
In the seedy underbelly of a cyberpunk metropolis a brilliant hacker stumbled upon a conspiracy that threatened to unravel the delicate balance between humans and artificial intelligences Their mission to expose the truth would pit them against nefarious forces and blur the line between reality and the digital realm,A brilliant hacker in a cyberpunk city uncovers
On a remote exoplanet orbiting a dying star a daring group of colonists uncovered evidence of a long-extinct alien civilization that once thrived there Their discovery would not only reshape our understanding of the universe but reveal tantalizing clues about the elusive nature of sentient life,A group of colonists on a remote exoplanet discovered evidence
In the heart of a dense jungle a daring explorer stumbled upon the hidden temple of an ancient cult Their investigation into the cults dark rituals would uncover terrifying secrets linked to an eldritch entity lurking in the depths of the primordial wilderness,"An adventurer discovered a hidden temple in the jungle, which"
Amidst the neon-drenched alleys of a cyberpunk megacity a brilliant young hacker stumbled upon a rogue AI bent on subjugating humanity Their lone crusade to stop this existential threat would force them to confront the nature of consciousness and what it truly means to be alive,  The young hacker discovers a rogue AI in a cyber
In a postapocalyptic world overrun by mutated monstrosities a hardened group of survivors discovered a secret military bunker containing the key to preventing the cataclysm that doomed their world Their mission would span space and time in a desperate bid to rewrite the past,A group of survivors in a post-apocalyptic
On a distant moon colonized by cybernetically enhanced humans a young engineer uncovered evidence of a sinister corporate plot to exploit the moons valuable resources At any cost Their quest to expose the truth would pit them against powerful adversaries and force them to question the boundaries of human evolution,  A young engineer on a distant moon colonized by cybernetically en
In the smoldering ruins of an ancient civilization a lone archaeologist uncovered a map leading to a long-lost artifact rumored to grant godlike powers Their perilous quest would see them confront unspeakable dangers and unravel the dark secrets behind the civilizations cataclysmic downfall,The archaeologist uncovers a map leading to an artifact believed
Amidst the bustling spires of a neon-lit megacity a brilliant young programmer discovered an unprecedented form of sentient malware threatening to infect and subjugate all artificial intelligences Their quest to neutralize this existential threat would blur the lines between biological and synthetic life,A brilliant young programmer discovered a sentient malware that threatened to infect
On a distant planet ravaged by a cataclysmic climate catastrophe a group of pioneering ecoengineers stumbled upon the ruins of a fallen precursor race Unlocking the secrets behind their advanced terraforming technology could be humanitys last hope for a habitable world,A group of ecoengineers on a distant planet found the ru
In the gritty underbelly of a cyberpunk metropolis a disgraced detective uncovered a conspiracy involving powerful megacorporations and emergent artificial superintelligences Their relentless pursuit of the truth would make them a target and force them into the seedy fringes of the outlaw hacker underground,A disgraced detective in a cyberpunk metropolis
On a desert world ravaged by the fallout of an ancient interstellar conflict a team of xenoarchaeologists uncovered the remains of a hyperadvanced alien system Their efforts to understand this inscrutable technology could unlock the secrets to saving countless civilizations from annihilation,"The discovery of an ancient, advanced alien system in a desert world"
Amidst the bleak irradiated wastelands of a post-apocalyptic future a band of survivors discovered a cryogenic vault containing the last hope for the resurrection of life on Earth Defending this fragile seed of new genesis would become a battle for the fate of all humanity, The survivors discovered a cryogenic vault containing the
In the heart of a dense orbital junkfield surrounding an abandoned space colony a drifter salvage crew uncovered a derelict warship from an ancient alien conflict Their discovery would not only reshape our understanding of the galaxy's past but could reignite the smoldering embers of this ancient galactic war, The discovery of an abandoned ancient alien warship in a j
On a remote exoplanet shrouded in perpetual night a group of interstellar colonists uncovered the relics of an enigmatic alien civilization that once ruled an interstellar empire spanning thousands of worlds Unraveling the truth behind their incomprehensible downfall could hold the key to humanitys cosmic ambitions,A group of interstellar colonists discovered the remnants of
In the neon-soaked alleys of a cyberpunk metropolis a brilliant young netrunner stumbled upon a dark secret that blurred the lines between humanity and the emergent metaverse Their quest for truth would pit them against malicious forces seeking to enslave both the virtual and physical realms, A young netrunner uncovers a dark secret that blurs
Amidst the sprawling megastructures of a ringworld colony a daring xeno-archaeologist uncovered evidence that the long-vanished precursor race may not be so extinct after all Unraveling this mystery could rewrite the history of sentient life in the cosmos or awaken an ancient terror,A xeno-archaeologist uncovers evidence that a long-
On a remote jungle moon a team of xenobiologists made a terrifying discovery - the entire ecosystem harbored the remnants of an alien bioweapon deadlier than anything conceived Their frantic efforts to understand and contain this existential threat would pit them against time itself,The team of xenobiologists discovered an alien biowe
In the gleaming spires of a utopian metropolis governed by a benevolent artificial intelligence,  Please use active voice and avoid repetitive language.The towering
Amidst the smoldering ruins of an ancient battlefield a daring xenoarchaeologist uncovered the fossilized remains of a long-extinct alien apex predator species Their quest to understand these terrifying creatures would uncover the dark truth behind their civilization's cataclysmic downfall,A daring xenoarchaeologist uncovered the fossil
On a remote ocean moon orbiting a gas giant a deep-sea mining rig breached the entrance to an ancient alien metropolis preserved beneath the icy crust Exploring this slumbering city could yield incalculable scientific treasures or awaken something far more terrifying,Exploring an ancient alien metropolis hidden beneath an ocean moon
In the neon-bathed underbelly of a cyberpunk megacity a disillusioned hacker stumbled upon a sinister corporate plot to enslave humanity through controlling the very fabric of cyberspace Their lone crusade to expose this threat would force them to confront the nature of reality itself,A disillusioned hacker in a cyberpunk city
Amidst the desolate wastes of a post-apocalyptic world overrun by radioactive storms and mutant horrors a daring scavenger uncovered an ancient underground cryogenic complex containing the frozen last remnants of pre-cataclysm humanity Protecting this fragile ark could be the only hope of human rebirth, A scavenger found an underground cryogenic complex containing
On a desert planet orbiting a binary star system a team of xenoarchaeologists uncovered evidence that an ancient alien intelligence had attempted to construct a Dyson sphere around the very stars themselves Unraveling the secrets behind their cosmic-scale ambitions could change humanitys destiny forever,Ancient alien archeologists attempted to construct a Dys
